PubmedID,Title,Publication Date,Non-academic Author(s),Company Affiliation(s),Corresponding Author Email
40679809,AI Prognostication in Nonsmall Cell Lung Cancer: A Systematic Review.,2025-Jul-18,Kelsey Lyons,Departments of Biomedical Engineering.,
40679708,Tumor infiltration therapy: from FDA approval to next-generation approaches.,2025-Jul-18,Rahaman Shaik; Sai Abhistika Royyala; Bhanu Inapanuri; Akshaya Durgam; Huda Khan; Adeeb Unnisa,"Department of Pharmacology, School of Pharmaceutical Education & Research, Jamia Hamdard, New Delhi, 110062, India. shaikrahaman_sch@jamiahamdard.ac.in.; Department of Pharmacology, St. Pauls College of Pharmacy, Turkayamjal, Hyderabad, Telangana, 501510, India.; Department of Pharmacology, St. Pauls College of Pharmacy, Turkayamjal, Hyderabad, Telangana, 501510, India.; Department of Pharmacology, St. Pauls College of Pharmacy, Turkayamjal, Hyderabad, Telangana, 501510, India.; Department of Pharmacology, St. Pauls College of Pharmacy, Turkayamjal, Hyderabad, Telangana, 501510, India.; Department of Pharmacology, St. Pauls College of Pharmacy, Turkayamjal, Hyderabad, Telangana, 501510, India.",shaikrahaman_sch@jamiahamdard.ac.in
40679432,Research progress of norcantharidin nanodrugs for tumor treatment.,2025-Jul-18,Yong You,"Jingmen Central Hospital, No. 168 Xiangshan Road, Duodao District, Jingmen, 448000, PR China.",
40679370,A Scoring System for Risk Stratification in Intrahepatic Cholangiocarcinoma after Immunotherapy.,2025-Jul,Tingting Mu; Fei Li,"Department of Radiology, Dongying People's Hospital, Shandong, China.; Department of Radiology, Dongying People's Hospital, Shandong, China.",
40679256,Hyponatremia predicts immunotherapy resistance in biliary tract cancer.,2025-Dec,Tiance Wang; Zijian Lv; Runjia Fan; Weidong Han; Qian Mei,"Department of Bio-Therapeutic, the First Medical Center, Chinese PLA General Hospital, Beijing, China.; Department of Bio-Therapeutic, the First Medical Center, Chinese PLA General Hospital, Beijing, China.; Department of Bio-Therapeutic, the First Medical Center, Chinese PLA General Hospital, Beijing, China.; Department of Bio-Therapeutic, the First Medical Center, Chinese PLA General Hospital, Beijing, China.; Department of Bio-Therapeutic, the First Medical Center, Chinese PLA General Hospital, Beijing, China.",
40679247,11th Immunotherapy of Cancer conference (ITOC): A meeting report.,2025-Dec,Volkmar Nüssler; Christoph Zielinski,"Tumorzentrum München, Munich, Germany.; Central European Cooperative Oncology Group and Central European Cancer Center, Wiener Privatklinik, Vienna, Austria.",
